{
  "schema_version": "0.1",
  "pairing_id": "m7-forced-failure-counterfactual",
  "version": 1,
  "question": "Does the forced-failure condition change the declared suite outcomes, disappear after restoration, and remain absent under a negative control?",
  "primary_variable": {
    "name": "experiment_condition",
    "source": "pairing-fixture"
  },
  "roles": {
    "BASELINE": {
      "plan_sha256": "6d1760daab166f29ddecb7a4414617352b9bd0e58093d2830c0b1c86a04a6eda",
      "primary_value": "nominal"
    },
    "TREATMENT": {
      "plan_sha256": "e872afe5b0722510f42f1b950f8919bf641688b498c139396f488ba2ac3df54e",
      "primary_value": "forced_failure"
    },
    "RESTORED_BASELINE": {
      "plan_sha256": "6d1760daab166f29ddecb7a4414617352b9bd0e58093d2830c0b1c86a04a6eda",
      "primary_value": "nominal"
    },
    "NEGATIVE_CONTROL": {
      "plan_sha256": "761589389d551519723040417a2fb5cd586b044b250eb0f0ec165fc9198e8179",
      "primary_value": "negative_control"
    }
  },
  "sequence": [
    "BASELINE",
    "TREATMENT",
    "RESTORED_BASELINE",
    "NEGATIVE_CONTROL"
  ],
  "warmup": {
    "mode": "NONE",
    "iterations": 0
  },
  "outcomes": [
    {
      "assertion_id": "suite-completed-successfully",
      "expected_actual": {
        "BASELINE": true,
        "TREATMENT": false,
        "RESTORED_BASELINE": true,
        "NEGATIVE_CONTROL": true
      }
    },
    {
      "assertion_id": "suite-has-zero-failures",
      "expected_actual": {
        "BASELINE": 0,
        "TREATMENT": 1,
        "RESTORED_BASELINE": 0,
        "NEGATIVE_CONTROL": 0
      }
    }
  ],
  "limits": [
    "SUPPORTED applies only to the four immutable Runs and exact sealed Plans named by this PairingPlan.",
    "PairedAnalysis does not replace any source Run Verdict.",
    "PairingPlan 0.1 does not provide statistical significance or repeated-run aggregation."
  ],
  "reproduction_steps": [
    "Seal this PairingPlan before creating any paired analysis.",
    "Evaluate BASELINE, TREATMENT, RESTORED_BASELINE, and NEGATIVE_CONTROL in that order.",
    "Run pair with the four immutable Bundles and the sealed PairingPlan."
  ],
  "cleanup_steps": [
    "Verify no pairing staging directory remains.",
    "Remove only newly created ignored artifacts after review."
  ]
}
